<?xml version="1.0" encoding="UTF-8"?>

<!ELEMENT language (errorMessage|trad)*>
<!ATTLIST language lang CDATA #REQUIRED>

	<!ELEMENT errorMessage (message+)>
	<!ELEMENT trad (message+)>

		<!ELEMENT message (#PCDATA)>
		<!ATTLIST message code CDATA #REQUIRED>