<?xml version="1.0" encoding="UTF-8"?>
<!DOCTYPE language SYSTEM "xmli18n.dtd">

<language lang="en">

    <trad>
        <message code="notice">Notice</message>
        <message code="warning">Warning</message>
        <message code="error">Error</message>
        <message code="fatalerror">Fatal error</message>
        <message code="file">File</message>
        <message code="line">Line</message>
	    <message code="appliError">Application</message>
	    <message code="fileSysError">File system</message>
	    <message code="fileError">File</message>
        <message code="restReqError">Request</message>
        <message code="restResError">Response</message>
        <message code="serverError">Server and execution environment information</message>
        <message code="headManError">Header Manager</message>
        <message code="confError">Configuration file</message>
        <message code="dataError">Data error</message>
    </trad>

    <errorMessage>
	    <message code="10000">Error displaying class "%s" does not exist.</message>
	    <message code="10100">OS "%s" is not suported or is not valid.</message>
	    <message code="10101">Base path "%s" is not absolute.</message>
	    <message code="10102">Base path "%s" does not exist.</message>
	    <message code="10103">File "%s" does not exist, unable to get file perms.</message>
	    <message code="10104">File "%s" could not be created (permissions problem ?).</message>
	    <message code="10105">File "%s" does not exist and nothing got charged.</message>
	    <message code="10106">File with extension "%s" can't be loaded. (File: %s)</message>
	    <message code="10200">Empty filename.</message>
	    <message code="10201">The file %s has no extension.</message>
	    <message code="10202">Empty directory name.</message>
	    <message code="10203">File "%s" does not exist.</message>
	    <message code="10204">Destination folder "%s" does not exist.</message>
	    <message code="10205">Error while trying to create file "%s".</message>
	    <message code="20000">Invalid HTML method "%s". Check http://www.w3.org/Protocols/rfc2616/rfc2616-sec9.html for more informations about valid methods.</message>
	    <message code="20001">No valid return format found.</message>
	    <message code="20002">Invalid server data.</message>
	    <message code="20100">Invalid response data.</message>
	    <message code="20101">HTTP code "%s" is not valid. Check http://www.w3.org/Protocols/rfc2616/rfc2616-sec10.html for more informations about HTTP code.</message>
	    <message code="20102">Output format set (%s) does not exist in available outputs.</message>
	    <message code="20103">Default output format invalid.</message>
	    <message code="20104">Accepted output format are invalid.</message>
	    <message code="20105">Invalid charset %s.</message>
	    <message code="20106">Default output format "%s" not found in configuration.</message>
	    <message code="20107">Specified output rendering class (%s) not found.</message>
	    <message code="20200">Key %s does not exist in the URI.</message>
	    <message code="20201">Requested parameter %s does not exist.</message>
	    <message code="20300">Missing server variables.</message>
	    <message code="20301">Invalid HTML method "%s". Check http://www.w3.org/Protocols/rfc2616/rfc2616-sec9.html for more informations about valid methods.</message>
	    <message code="20400">Response header "%s" is invalid. Check http://www.w3.org/Protocols/rfc2616/rfc2616-sec14.html for more informations about headers.</message>
		<message code="30000">Framework's configuration file not found. (Should be located: %s)</message>
	    <message code="30001">Key %s must be present but does not exist in the configuration.</message>
	    <message code="30002">Key %s does not exist in the configuration.</message>
	    <message code="40000">Language "%s" is not associated with any translation. Language used instead: %s.</message>
	    <message code="40001">Default language "%s" file (%s) not found. Language loaded instead: %s.</message>
	    <message code="40002">Default language "%s" file (%s) invalid (%s). Language loaded instead: %s.</message>
	    <message code="40003">Language file for %s not found. (Should be: %s)</message>
	    <message code="40004">Language file for %s invalid (%s). (%s)</message>
	    <message code="40005">No valid translation file set or found.</message>
        <message code="40006">Translation for the entity "%s.%s" not found.</message>
    </errorMessage>

</language>